{
  "schema_version": "1.0.0",
  "record_id": "SYN-DEMO-0001",
  "synthetic": true,
  "consent": {
    "purpose": "stegva_synthetic_demonstration",
    "granted": true,
    "expires_at": "2027-01-01T00:00:00Z"
  },
  "claim_context": {
    "benefit_type": "synthetic-disability-compensation",
    "stage": "preparation"
  },
  "evidence_items": [
    {
      "evidence_id": "EVID-DEMO-001",
      "category": "synthetic-service-record",
      "synthetic": true
    }
  ]
}
